{
  "schema_version": 1,
  "dataset_kind": "curated",
  "as_of": "2026-10-26",
  "region_policy": "europe-us-v1",
  "sources": [
    {
      "id": "renault-2025-world",
      "title": "Renault brand achieves +10% global passenger car sales growth in 2025, driven by successful product offensive",
      "publisher": "Renault",
      "source_kind": "sales",
      "url": "https://media.renault.com/renault-brand-achieves-10-global-passenger-car-sales-growth-in-2025-driven-by-successful-product-offensive/",
      "retrieved_at": "2026-10-26",
      "published_at": "2026-01-20",
      "sha256": "3b83ca243e6201460b765790f5d95706c5425a33365fe8a17fdd1b9d8116ff35",
      "locator": "Our European best sellers | product highlights / Clio 5",
      "quote": "Clio 5 sales increased by +4.5% vs. 2024 reaching 243,401 units in its final year on the market (N°2 passenger car in Europe after Sandero).",
      "reuse": "citation_only",
      "license": null,
      "redistribution_allowed": false
    },
    {
      "id": "renault-fr-2025",
      "title": "Résultats commerciaux 2025 : succès des nouveaux produits, stratégie commerciale robuste et leadership technologique renforcent la domination de Renault sur le marché français",
      "publisher": "Renault",
      "source_kind": "sales",
      "url": "https://media.renault.com/resultats-commerciaux-2025-succes-des-nouveaux-produits-strategie-commerciale-robuste-et-leadership-technologique-renforcent-la-domination-de-renault-sur-le-marche-francais/",
      "retrieved_at": "2026-10-26",
      "published_at": "2026-01-02",
      "sha256": "3f6e80b6567f081e7c71d4d93ecaa10e23a509d06ff62c561a3023f4db74a588",
      "locator": "Sur le marché VU / podium des ventes Trafic, Master, Kangoo",
      "quote": "Kangoo complète le podium avec 24 405 unités.",
      "reuse": "citation_only",
      "license": null,
      "redistribution_allowed": false
    },
    {
      "id": "subaru-us-2025",
      "title": "SUBARU OF AMERICA REPORTS DECEMBER 2025 AND YEAR-END SALES RESULTS",
      "publisher": "Subaru of America",
      "source_kind": "sales",
      "url": "https://media.subaru.com/pressrelease/2410/subaru-america-reports-december-2025-year-end-sales",
      "retrieved_at": "2026-10-26",
      "published_at": "2026-01-05",
      "sha256": "1dfe5da9fee9c5155d6a4562ebdac87936fa450131af79547ed1863548bdfae1",
      "locator": "Carline sales table / Forester row / Dec-25 YTD (not Dec-25 MTD)",
      "quote": "Forester 15,393 17,149 -10.2% 175,070 175,521 -0.3%",
      "reuse": "citation_only",
      "license": null,
      "redistribution_allowed": false
    },
    {
      "id": "ecfr-40cfr-86-1806-17-b1",
      "title": "40 CFR 86.1806-17 — Onboard diagnostics",
      "publisher": "U.S. eCFR (EPA rule text)",
      "source_kind": "regulation",
      "url": "https://www.ecfr.gov/current/title-40/chapter-I/subchapter-C/part-86/subpart-S/section-86.1806-17",
      "retrieved_at": "2026-10-26",
      "published_at": null,
      "sha256": "14fbe45acd5775c8498fbb105b9da99c32fbcbc9920c1d4134b40737cb8ef13b",
      "locator": "(b)(1)",
      "quote": "For a 0.020 inch leak, the DTC(s) shall be a generic SAE J2012 DTC that is specific to an EVAP system very small leak (e.g., P0456, P04EE, or P04EF) or an equivalent manufacturer-specific DTC that we approve.",
      "reuse": "citation_only",
      "license": null,
      "redistribution_allowed": false
    }
  ],
  "models": [
    {
      "id": "renault-clio-5",
      "make": "Renault",
      "name": "Clio 5",
      "vehicle_class": "passenger_car",
      "identity_status": "verified",
      "source_id": "renault-2025-world"
    },
    {
      "id": "renault-kangoo-van",
      "make": "Renault",
      "name": "Kangoo VAN",
      "vehicle_class": "light_commercial",
      "identity_status": "verified",
      "source_id": "renault-fr-2025"
    },
    {
      "id": "subaru-forester",
      "make": "Subaru",
      "name": "Forester",
      "vehicle_class": "suv",
      "identity_status": "verified",
      "source_id": "subaru-us-2025"
    }
  ],
  "variants": [
    {
      "id": "renault-clio-5-identity-pending",
      "model_id": "renault-clio-5",
      "market": "EUROPE",
      "model_year": null,
      "generation": null,
      "engine_code": null,
      "transmission_code": null,
      "variant_code": null,
      "battery_code": null,
      "ecu_software": null,
      "powertrain": "unknown",
      "verification": "pending",
      "source_id": null
    },
    {
      "id": "renault-kangoo-van-identity-pending",
      "model_id": "renault-kangoo-van",
      "market": "FR",
      "model_year": null,
      "generation": null,
      "engine_code": null,
      "transmission_code": null,
      "variant_code": null,
      "battery_code": null,
      "ecu_software": null,
      "powertrain": "unknown",
      "verification": "pending",
      "source_id": null
    },
    {
      "id": "subaru-forester-identity-pending",
      "model_id": "subaru-forester",
      "market": "US",
      "model_year": null,
      "generation": null,
      "engine_code": null,
      "transmission_code": null,
      "variant_code": null,
      "battery_code": null,
      "ecu_software": null,
      "powertrain": "unknown",
      "verification": "pending",
      "source_id": null
    }
  ],
  "sales": [
    {
      "id": "renault-clio-5-sales-2025",
      "model_id": "renault-clio-5",
      "source_id": "renault-2025-world",
      "locator": "Our European best sellers | product highlights / Clio 5",
      "quote": "Clio 5 sales increased by +4.5% vs. 2024 reaching 243,401 units in its final year on the market (N°2 passenger car in Europe after Sandero).",
      "year": 2025,
      "period_start": "2025-01-01",
      "period_end": "2025-12-31",
      "market": "EUROPE",
      "metric": "sales",
      "units": 243401,
      "identity_scope": "exact_model",
      "geography_status": "in_scope",
      "verification": "verified"
    },
    {
      "id": "renault-kangoo-van-sales-2025",
      "model_id": "renault-kangoo-van",
      "source_id": "renault-fr-2025",
      "locator": "Sur le marché VU / podium des ventes Trafic, Master, Kangoo",
      "quote": "Kangoo complète le podium avec 24 405 unités.",
      "year": 2025,
      "period_start": "2025-01-01",
      "period_end": "2025-12-31",
      "market": "FR",
      "metric": "sales",
      "units": 24405,
      "identity_scope": "exact_model",
      "geography_status": "in_scope",
      "verification": "verified"
    },
    {
      "id": "subaru-forester-sales-2025",
      "model_id": "subaru-forester",
      "source_id": "subaru-us-2025",
      "locator": "Carline sales table / Forester row / Dec-25 YTD (not Dec-25 MTD)",
      "quote": "Forester 15,393 17,149 -10.2% 175,070 175,521 -0.3%",
      "year": 2025,
      "period_start": "2025-01-01",
      "period_end": "2025-12-31",
      "market": "US",
      "metric": "sales",
      "units": 175070,
      "identity_scope": "exact_model",
      "geography_status": "in_scope",
      "verification": "verified"
    }
  ],
  "parameters": [
    {
      "id": "engine_rpm",
      "column": "engine_rpm",
      "name": {
        "es": "Régimen del motor",
        "en": "Engine speed",
        "de": "Motordrehzahl"
      },
      "unit": "rpm",
      "physical_min": 0,
      "physical_max": null
    },
    {
      "id": "engine_load_pct",
      "column": "engine_load_pct",
      "name": {
        "es": "Carga del motor",
        "en": "Engine load",
        "de": "Motorlast"
      },
      "unit": "%",
      "physical_min": 0,
      "physical_max": 100
    },
    {
      "id": "coolant_temp_c",
      "column": "coolant_temp_c",
      "name": {
        "es": "Temperatura del refrigerante",
        "en": "Coolant temperature",
        "de": "Kühlmitteltemperatur"
      },
      "unit": "°C",
      "physical_min": -273.15,
      "physical_max": null
    },
    {
      "id": "oil_temp_c",
      "column": "oil_temp_c",
      "name": {
        "es": "Temperatura del aceite",
        "en": "Oil temperature",
        "de": "Öltemperatur"
      },
      "unit": "°C",
      "physical_min": -273.15,
      "physical_max": null
    },
    {
      "id": "oil_pressure_bar",
      "column": "oil_pressure_bar",
      "name": {
        "es": "Presión de aceite",
        "en": "Oil pressure",
        "de": "Öldruck"
      },
      "unit": "bar",
      "physical_min": 0,
      "physical_max": null
    },
    {
      "id": "boost_pressure_bar",
      "column": "boost_pressure_bar",
      "name": {
        "es": "Presión absoluta de admisión",
        "en": "Absolute intake pressure",
        "de": "Absoluter Saugrohrdruck"
      },
      "unit": "bar (abs.)",
      "physical_min": 0,
      "physical_max": null
    },
    {
      "id": "egt_c",
      "column": "egt_c",
      "name": {
        "es": "Temperatura de gases de escape",
        "en": "Exhaust gas temperature",
        "de": "Abgastemperatur"
      },
      "unit": "°C",
      "physical_min": -273.15,
      "physical_max": null
    },
    {
      "id": "dpf_diff_pressure_kpa",
      "column": "dpf_diff_pressure_kpa",
      "name": {
        "es": "Presión diferencial del DPF",
        "en": "DPF differential pressure",
        "de": "Differenzdruck am Dieselpartikelfilter"
      },
      "unit": "kPa",
      "physical_min": 0,
      "physical_max": null
    },
    {
      "id": "battery_voltage_v",
      "column": "battery_voltage_v",
      "name": {
        "es": "Tensión de batería",
        "en": "Battery voltage",
        "de": "Batteriespannung"
      },
      "unit": "V",
      "physical_min": 0,
      "physical_max": null
    },
    {
      "id": "gearbox_oil_temp_c",
      "column": "gearbox_oil_temp_c",
      "name": {
        "es": "Temperatura del aceite de transmisión",
        "en": "Transmission oil temperature",
        "de": "Getriebeöltemperatur"
      },
      "unit": "°C",
      "physical_min": -273.15,
      "physical_max": null
    },
    {